"id:ID","name",":LABEL"
"pub_journals/ijmi/LiuEKCPBH21","Publication of Developing a maturity model for cancer multidisciplinary teams.","ResearchPublication"
"pub_journals/na/Watson06","Publication of Fitting enclosing cylinders to data in ","ResearchPublication"
"pub_journals/mktsci/MayzlinS11","Publication of Uninformative Advertising as an Invitation to Search.","ResearchPublication"
"pub_journals/lre/LeacockC03","Publication of C-rater: Automated Scoring of Short-Answer Questions.","ResearchPublication"
"pub_journals/jors/AlcarazMR22","Publication of Ranking ranges in cross-efficiency evaluations: A metaheuristic approach.","ResearchPublication"
"pub_journals/oms/DuranC08","Publication of Parameter optimization for differential equations in asset price forecasting.","ResearchPublication"
"pub_journals/rfc/rfc1454","Publication of Comparison of Proposals for Next Version of IP.","ResearchPublication"
"pub_journals/rfc/rfc2757","Publication of Long Thin Networks.","ResearchPublication"
"pub_journals/staeors/KwakPF14","Publication of Near Real-Time Flood Volume Estimation From MODIS Time-Series Imagery in the Indus River Basin.","ResearchPublication"
"pub_journals/tcns/DekaDMS22","Publication of Tractable Learning in Underexcited Power Grids.","ResearchPublication"
"pub_journals/tit/Krzyzak90","Publication of On estimation of a class of nonlinear systems by the kernel regression estimate.","ResearchPublication"
"pub_journals/bc/IchinoseA01","Publication of Detection of mutual determinism between a pair of spike trains.","ResearchPublication"
"pub_journals/ram/MoradiKPMFSR13","Publication of Service robotics (the rise and bloom of service robots) [tc spotlight].","ResearchPublication"
"pub_journals/jasss/BoeroCS04","Publication of Micro Behavioural Attitudes and Macro Technological Adaptation in Industrial Districts: an Agent-Based Prototype.","ResearchPublication"
"pub_journals/siamsc/WillertKKP13","Publication of Hybrid Deterministic/Monte Carlo Neutronics.","ResearchPublication"
"pub_journals/ppna/MaWCYM14","Publication of A research on dynamic allocation of network resources based on P2P traffic planning.","ResearchPublication"
"pub_journals/sivp/KovacM23","Publication of Finger vein recognition: utilization of adaptive gabor filters in the enhancement stage combined with SIFT/SURF-based feature extraction.","ResearchPublication"
"pub_journals/arc/DownsS11","Publication of An industrial and academic perspective on plantwide control.","ResearchPublication"
"pub_journals/eswa/SadeghiDZ21","Publication of Combined ensemble multi-class SVM and fuzzy NSGA-II for trend forecasting and trading in Forex markets.","ResearchPublication"
"pub_journals/cssc/OzkaleA23","Publication of Bootstrap selection of ridge regularization parameter: a comparative study via a simulation study.","ResearchPublication"
"pub_journals/csysl/WangWLL24","Publication of Output-Constrained Switching Anti-Windup Compensation for Aero-Engines With Asymmetric Input Saturation.","ResearchPublication"
"pub_journals/bioinformatics/KimCSZ23","Publication of Robust genetic model-based SNP-set association test using CauchyGM.","ResearchPublication"
"pub_journals/bioinformatics/AulchenkoRID07","Publication of GenABEL: an R library for genome-wide association analysis.","ResearchPublication"
"pub_journals/bioinformatics/SuzekWHMW15","Publication of UniRef clusters: a comprehensive and scalable alternative for improving sequence similarity searches.","ResearchPublication"
"pub_journals/alr/SaitoMHI20","Publication of Visualization of dynamic structure in flocking behavior.","ResearchPublication"
"pub_journals/dam/BermudoHMV24","Publication of The Geometric-Arithmetic index of trees with a given total domination number.","ResearchPublication"
"pub_journals/saem/ZhangKBT14","Publication of Enhanced bearing fault detection and degradation analysis based on narrowband interference cancellation.","ResearchPublication"
"pub_journals/ior/ShiO00","Publication of Nested Partitions Method for Global Optimization.","ResearchPublication"
"pub_journals/tcad/ZhouDZZLL0GCC19","Publication of Addressing Sparsity in Deep Neural Networks.","ResearchPublication"
"pub_journals/tcad/MukherjeeFBL12","Publication of Efficient Identification of Unstable Loops in Large Linear Analog Integrated Circuits.","ResearchPublication"
"pub_journals/mta/GuptaSS17","Publication of Multimedia tool as a predictor for social media advertising- a YouTube way.","ResearchPublication"
"pub_journals/mta/HafizBH23","Publication of Image classification using convolutional neural network tree ensembles.","ResearchPublication"
"pub_journals/mta/AliTDIK21","Publication of Classical and modern face recognition approaches: a complete review.","ResearchPublication"
"pub_journals/mta/HuangRJY22","Publication of Single-channel EEG automatic sleep staging based on transition optimized HMM.","ResearchPublication"
"pub_journals/mta/LiZHT16","Publication of Guest Editorial: Large-Scale Multimedia Content Analysis on Social Media.","ResearchPublication"
"pub_journals/mta/RabeeMM18","Publication of Blind JPEG steganalysis based on DCT coefficients differences.","ResearchPublication"
"pub_journals/vldb/MedjahedBBNE03","Publication of Business-to-business interactions: issues and enabling technologies.","ResearchPublication"
"pub_journals/cmpb/YanSSYMCCC22","Publication of SegNet-based left ventricular MRI segmentation for the diagnosis of cardiac hypertrophy and myocardial infarction.","ResearchPublication"
"pub_journals/cmpb/KalinliSAO13","Publication of Performance comparison of machine learning methods for prognosis of hormone receptor status in breast cancer tissue samples.","ResearchPublication"
"pub_journals/dke/SnodgrassDCCJ08","Publication of Validating quicksand: Temporal schema versioning in tauXSchema.","ResearchPublication"
"pub_journals/dke/KontopoulosBA08","Publication of Deploying defeasible logic rule bases for the semantic web.","ResearchPublication"
"pub_journals/combinatorics/Saldanha21","Publication of Domino Tilings of Cylinders: Connected Components under Flips and Normal Distribution of the Twist.","ResearchPublication"
"pub_journals/jcb/DewWS05","Publication of A Tool for Analyzing Mate Pairs in Assemblies (TAMPA).","ResearchPublication"
"pub_journals/displays/LiangYSD25","Publication of SPFusion: A multi-task semantic perception infrared and visible light fusion method with quality assessment.","ResearchPublication"
"pub_journals/urban/YabeTSU22","Publication of Early warning of COVID-19 hotspots using human mobility and web search query data.","ResearchPublication"
"pub_journals/jaihc/SinghG22","Publication of Some novel q-rung orthopair fuzzy correlation coefficients based on the statistical viewpoint with their applications.","ResearchPublication"
"pub_journals/dm/ChenCCLL24","Publication of Ramsey properties for V-shaped posets in the Boolean lattice.","ResearchPublication"
"pub_journals/dm/Rotem81","Publication of Stack sortable permutations.","ResearchPublication"
"pub_journals/lgrs/ChenWFLCYZY24","Publication of An Innovative Real-Time Nonlinear Frequency Modulation Signal Generator for Airborne SAR.","ResearchPublication"
"pub_journals/jpdc/ShestakCMS12","Publication of Probabilistic resource allocation in heterogeneous distributed systems with random failures.","ResearchPublication"
"pub_journals/jpdc/PlazaVPM06","Publication of Commodity cluster-based parallel processing of hyperspectral imagery.","ResearchPublication"
"pub_journals/mcss/CostaD88","Publication of Approximations for optimal stopping of a piecewise-deterministic process.","ResearchPublication"
"pub_journals/jcsc/AbdiDAR19","Publication of Slew Rate and Transient Response Enhancement in MOLDO with Modifying Error Amplifier Structure.","ResearchPublication"
"pub_journals/kais/ReddyRKT23","Publication of Enhanced U-Net segmentation with ensemble convolutional neural network for automated skin disease classification.","ResearchPublication"
"pub_journals/tits/LiuLWWYS23","Publication of Fuel Rate Prediction for Heavy-Duty Trucks.","ResearchPublication"
"pub_journals/tits/DaiZYCZDC22","Publication of Dynamic Scheduling, Operation Control and Their Integration in High-Speed Railways: A Review of Recent Research.","ResearchPublication"
"pub_journals/isci/KhreichGMS12","Publication of A survey of techniques for incremental learning of HMM parameters.","ResearchPublication"
"pub_journals/isci/Forgionne02","Publication of Selecting rail grade crossing investments with a decision support system.","ResearchPublication"
"pub_journals/tce/Haan00","Publication of Progress in motion estimation for consumer video format conversion.","ResearchPublication"
"pub_journals/jsis/Lee12","Publication of The coevolution of IT innovation and copyright institutions: The development of the mobile music business in Japan and Korea.","ResearchPublication"
"pub_journals/cma/YangL09","Publication of A multiplicative multisplitting method for solving the linear complementarity problem.","ResearchPublication"
"pub_journals/cma/LuDL10","Publication of The numerical simulation of periodic solutions for a predator-prey system.","ResearchPublication"
"pub_journals/istr/RahbariniaPLL14","Publication of PeerRush: Mining for unwanted P2P traffic.","ResearchPublication"
"pub_journals/cnsns/WuY24","Publication of A soft Lasso model for the motion of a ball falling in the non-Newtonian fluid.","ResearchPublication"
"pub_journals/tcas/MengJDY09","Publication of Robust Design of a Class of Time-Delay Iterative Learning Control Systems With Initial Shifts.","ResearchPublication"
"pub_journals/bspc/PengS23","Publication of The multimodal MRI brain tumor segmentation based on AD-Net.","ResearchPublication"
"pub_journals/cea/KimSKKLLHNPL21","Publication of DEM simulation for draft force prediction of moldboard plow according to the tillage depth in cohesive soil.","ResearchPublication"
"pub_journals/cea/LiuZJZRTW22","Publication of Prediction of laying hen house odor concentrations using machine learning models based on small sample data.","ResearchPublication"
"pub_journals/it/GusgenF88","Publication of Programmieren mit Constraints / Programming with Constraints.","ResearchPublication"
"pub_journals/wc/TaoJLXQL19","Publication of QoE Driven Resource Allocation in Next Generation Wireless Networks.","ResearchPublication"
"pub_journals/wc/PanagiotakisA02","Publication of Intelligent service mediation for supporting advanced location and mobility-aware service provisioning in reconfigurable mobile networks.","ResearchPublication"
"pub_journals/complexity/Peng22","Publication of Regional Economy Using Hybrid Sequence-to-Sequence-Based Deep Learning Approach.","ResearchPublication"
"pub_journals/dcg/Suk13","Publication of Disjoint Edges in Complete Topological Graphs.","ResearchPublication"
"pub_journals/sigarch/Dongarra88","Publication of Performance of various computers using standard linear equations software in a FORTRAN environment.","ResearchPublication"
"pub_journals/corr/abs-1808-10476","Publication of Impact of Device Orientation on Error Performance of LiFi Systems.","ResearchPublication"
"pub_journals/corr/abs-1301-2258","Publication of Instrumentality Tests Revisited","ResearchPublication"
"pub_journals/corr/LuYC16","Publication of Doubly Stochastic Neighbor Embedding on Spheres.","ResearchPublication"
"pub_journals/corr/abs-2202-09935","Publication of In the Arms of a Robot: Designing Autonomous Hugging Robots with Intra-Hug Gestures.","ResearchPublication"
"pub_journals/corr/abs-2409-05385","Publication of Towards Building a Robust Knowledge Intensive Question Answering Model with Large Language Models.","ResearchPublication"
"pub_journals/corr/abs-2212-09314","Publication of Bounds on Mixed Codes with Finite Alphabets.","ResearchPublication"
"pub_journals/corr/abs-2304-04217","Publication of The Study of Highway for Lifelong Multi-Agent Path Finding.","ResearchPublication"
"pub_journals/corr/abs-2007-08777","Publication of A direct reconstruction algorithm for the anisotropic inverse conductivity problem based on Caldern's method in the plane.","ResearchPublication"
"pub_journals/corr/abs-2501-10768","Publication of MAPS: Advancing Multi-Modal Reasoning in Expert-Level Physical Science.","ResearchPublication"
"pub_journals/corr/abs-2401-03257","Publication of RustNeRF: Robust Neural Radiance Field with Low-Quality Images.","ResearchPublication"
"pub_journals/corr/abs-2401-05709","Publication of Probability-based Distance Estimation Model for 3D DV-Hop Localization in WSNs.","ResearchPublication"
"pub_journals/corr/abs-2412-20993","Publication of Efficiently Serving LLM Reasoning Programs with Certaindex.","ResearchPublication"
"pub_journals/corr/abs-2110-03726","Publication of Bisimulations for Neural Network Reduction.","ResearchPublication"
"pub_journals/corr/abs-0911-2974","Publication of A Dynamic Near-Optimal Algorithm for Online Linear Programming","ResearchPublication"
"pub_journals/corr/abs-2410-01658","Publication of Smaller Confidence Intervals From IPW Estimators via Data-Dependent Coarsening.","ResearchPublication"
"pub_journals/corr/abs-1708-05347","Publication of Two weight Z","ResearchPublication"
"pub_journals/corr/abs-2207-00048","Publication of Privacy-preserving Graph Analytics: Secure Generation and Federated Learning.","ResearchPublication"
"pub_journals/corr/abs-2502-03321","Publication of Simplifying Formal Proof-Generating Models with ChatGPT and Basic Searching Techniques.","ResearchPublication"
"pub_journals/corr/abs-2105-09481","Publication of Localization and Control of Magnetic Suture Needles in Cluttered Surgical Site with Blood and Tissue.","ResearchPublication"
"pub_journals/corr/Pandey15","Publication of A note on linear fractional set packing problem.","ResearchPublication"
"pub_journals/corr/abs-2312-08976","Publication of Entity-Augmented Code Generation.","ResearchPublication"
"pub_journals/corr/abs-1003-0659","Publication of Particle Filtering on the Audio Localization Manifold","ResearchPublication"
"pub_journals/corr/abs-2212-06561","Publication of What is the Best Way to Optimally Parameterize the MPC Cost Function for Vehicle Guidance?","ResearchPublication"
"pub_journals/corr/abs-1212-6810","Publication of Web Analytics for Security Informatics","ResearchPublication"
"pub_journals/corr/abs-2501-12851","Publication of ACEBench: Who Wins the Match Point in Tool Learning?","ResearchPublication"
"pub_journals/corr/abs-1801-00880","Publication of Deep convolutional neural networks for segmenting 3D in vivo multiphoton images of vasculature in Alzheimer disease mouse models.","ResearchPublication"
"pub_journals/corr/abs-2001-04042","Publication of Minimizing Age of Information via Hybrid NOMA/OMA.","ResearchPublication"
"pub_journals/corr/abs-2204-11575","Publication of Deep Reinforcement Learning for Orienteering Problems Based on Decomposition.","ResearchPublication"
"pub_journals/corr/abs-2308-11651","Publication of Distributionally Robust Cross Subject EEG Decoding.","ResearchPublication"
"pub_journals/corr/abs-2005-09927","Publication of Range Conditioned Dilated Convolutions for Scale Invariant 3D Object Detection.","ResearchPublication"
"pub_journals/corr/abs-2412-17099","Publication of Additive and Multiplicative Coinvariant Spaces of Weyl Groups in the Light of Harmonics and Graded Transfer.","ResearchPublication"
"pub_journals/corr/abs-0804-3361","Publication of Recognition of Epileptic EEG Using Probabilistic Neural Network","ResearchPublication"
"pub_journals/corr/abs-1811-09620","Publication of TimbreTron: A WaveNet(CycleGAN(CQT(Audio))) Pipeline for Musical Timbre Transfer.","ResearchPublication"
"pub_journals/corr/abs-2307-00735","Publication of Novelty and Lifted Helpful Actions in Generalized Planning.","ResearchPublication"
"pub_journals/corr/abs-2204-09268","Publication of Uncertainty-based Cross-Modal Retrieval with Probabilistic Representations.","ResearchPublication"
"pub_journals/corr/abs-1802-02049","Publication of A Distance Between Channels: the average error of mismatched channels.","ResearchPublication"
"pub_journals/corr/abs-1010-3685","Publication of The set of realizations of a max-plus linear sequence is semi-polyhedral","ResearchPublication"
"pub_journals/corr/abs-cs-0412007","Publication of Exploring networks with traceroute-like probes: theory and simulations","ResearchPublication"
"pub_journals/corr/abs-1906-06620","Publication of Joint Visual-Textual Embedding for Multimodal Style Search.","ResearchPublication"
"pub_journals/corr/abs-2411-06202","Publication of Advanced Wildfire Prediction in Morocco: Developing a Deep Learning Dataset from Multisource Observations.","ResearchPublication"
"pub_journals/corr/abs-2206-13602","Publication of Molecular Geometry Pretraining with SE(3)-Invariant Denoising Distance Matching.","ResearchPublication"
"pub_journals/corr/abs-2303-12756","Publication of MaskCon: Masked Contrastive Learning for Coarse-Labelled Dataset.","ResearchPublication"
"pub_journals/corr/abs-1302-3946","Publication of Approximating the optimal competitive ratio for an ancient online scheduling problem","ResearchPublication"
"pub_journals/corr/HellmuthFWS15","Publication of Techniques for the Cograph Editing Problem: Module Merge is equivalent to Editing P4s.","ResearchPublication"
"pub_journals/corr/abs-2408-09065","Publication of Linking Robustness and Generalization: A k* Distribution Analysis of Concept Clustering in Latent Space for Vision Models.","ResearchPublication"
"pub_journals/corr/MajumdarMS16","Publication of Compositional Synthesis of Finite State Abstractions.","ResearchPublication"
"pub_journals/corr/abs-2002-03731","Publication of CO-Optimal Transport.","ResearchPublication"
"pub_journals/corr/abs-2305-02397","Publication of Widespread Increases in Future Wildfire Risk to Global Forest Carbon Offset Projects Revealed by Explainable AI.","ResearchPublication"
"pub_journals/corr/abs-2112-00588","Publication of Outlier Detection using AI: A Survey.","ResearchPublication"
"pub_journals/corr/abs-0906-3527","Publication of A universally fastest algorithm for Max 2-Sat, Max 2-CSP, and everything in between","ResearchPublication"
"pub_journals/corr/abs-2007-06371","Publication of Learning and Exploiting Interclass Visual Correlations for Medical Image Classification.","ResearchPublication"
"pub_journals/corr/abs-1805-03642","Publication of Adversarial Contrastive Estimation.","ResearchPublication"
"pub_journals/corr/abs-2402-08299","Publication of Zero Trust Score-based Network-level Access Control in Enterprise Networks.","ResearchPublication"
"pub_journals/corr/abs-2407-02348","Publication of Revisiting Cascaded Ensembles for Efficient Inference.","ResearchPublication"
"pub_journals/corr/abs-2005-13996","Publication of Chaos, Extremism and Optimism: Volume Analysis of Learning in Games.","ResearchPublication"
"pub_journals/corr/abs-1810-06519","Publication of Machine Self-Confidence in Autonomous Systems via Meta-Analysis of Decision Processes.","ResearchPublication"
"pub_journals/corr/abs-2406-06972","Publication of Generative Lifting of Multiview to 3D from Unknown Pose: Wrapping NeRF inside Diffusion.","ResearchPublication"
"pub_journals/corr/ClarkSW15a","Publication of Super-Languages: Developing Languages and Applications with XMF (Second Edition).","ResearchPublication"
"pub_journals/corr/abs-2311-18825","Publication of CAST: Cross-Attention in Space and Time for Video Action Recognition.","ResearchPublication"
"pub_journals/corr/abs-2003-06880","Publication of Grammars for Document Spanners.","ResearchPublication"
"pub_journals/corr/abs-1008-1427","Publication of Optimal Feedback Systems with Analogue Adaptive Transmitters","ResearchPublication"
"pub_journals/corr/abs-2004-05838","Publication of Are fast labeling methods reliable? A case study of computer-aided expert annotations on microscopy slides.","ResearchPublication"
"pub_journals/corr/abs-1907-03246","Publication of An Experimental-based Review of Image Enhancement and Image Restoration Methods for Underwater Imaging.","ResearchPublication"
"pub_journals/corr/abs-2002-02881","Publication of Low Rank Saddle Free Newton: Algorithm and Analysis.","ResearchPublication"
"pub_journals/corr/abs-1910-12908","Publication of Certified Adversarial Robustness for Deep Reinforcement Learning.","ResearchPublication"
"pub_journals/corr/abs-1708-02337","Publication of Unconstrained Face Detection and Open-Set Face Recognition Challenge.","ResearchPublication"
"pub_journals/corr/CarvajalMS14","Publication of Summarisation of Short-Term and Long-Term Videos using Texture and Colour.","ResearchPublication"
"pub_journals/corr/abs-2006-07057","Publication of Linear Time Sinkhorn Divergences using Positive Features.","ResearchPublication"
"pub_journals/corr/abs-2004-08546","Publication of FedNAS: Federated Deep Learning via Neural Architecture Search.","ResearchPublication"
"pub_journals/corr/abs-1911-06476","Publication of Deep Long Audio Inpainting.","ResearchPublication"
"pub_journals/corr/abs-2111-05294","Publication of Lattice structure design optimization under localized linear buckling constraints.","ResearchPublication"
"pub_journals/corr/abs-2311-09559","Publication of Enchancing Semi-Supervised Learning for Extractive Summarization with an LLM-based pseudolabeler.","ResearchPublication"
"pub_journals/corr/abs-2407-14192","Publication of LeKUBE: A Legal Knowledge Update BEnchmark.","ResearchPublication"
"pub_journals/corr/abs-2109-01652","Publication of Finetuned Language Models Are Zero-Shot Learners.","ResearchPublication"
"pub_journals/corr/abs-2308-09360","Publication of Multi-feature concatenation and multi-classifier stacking: an interpretable and generalizable machine learning method for MDD discrimination with rsfMRI.","ResearchPublication"
"pub_journals/corr/abs-1206-3136","Publication of The Glory of the Past and Geometrical Concurrency","ResearchPublication"
"pub_journals/ijdsa/RaniGG22","Publication of Big social data provenance framework for Zero-Information Loss Key-Value Pair (KVP) Database.","ResearchPublication"
"pub_journals/ngc/KingSS95","Publication of Relating Chemical Activity to Structure: An Examination of ILP Successes.","ResearchPublication"
"pub_paper_author_Zoltn_Katona_mobiquitous_2007","Publication of Research by Zoltn Katona at EAI Endorsed Trans. Ubiquitous Environ. 2007","ResearchPublication"
"pub_paper_author_Zoltn_Katona_mobiquitous_2015","Publication of Research by Zoltn Katona at EAI Endorsed Trans. Ubiquitous Environ. 2015","ResearchPublication"
"pub_paper_author_Zoltn_Katona_mobiquitous_2024","Publication of Research by Zoltn Katona at EAI Endorsed Trans. Ubiquitous Environ. 2024","ResearchPublication"
"pub_paper_author_Zoltn_Katona_mobiquitous_2022","Publication of Research by Zoltn Katona at EAI Endorsed Trans. Ubiquitous Environ. 2022","ResearchPublication"
"pub_paper_author_Babak_Rahbarinia_valuetools_2012","Publication of Research by Babak Rahbarinia at EAI Endorsed Trans. Ubiquitous Environ. 2012","ResearchPublication"
"pub_paper_author_Babak_Rahbarinia_valuetools_2014","Publication of Research by Babak Rahbarinia at EAI Endorsed Trans. Ubiquitous Environ. 2014","ResearchPublication"
"pub_paper_author_Babak_Rahbarinia_valuetools_2015","Publication of Research by Babak Rahbarinia at EAI Endorsed Trans. Ubiquitous Environ. 2015","ResearchPublication"
"pub_paper_author_Babak_Rahbarinia_valuetools_2016","Publication of Research by Babak Rahbarinia at EAI Endorsed Trans. Ubiquitous Environ. 2016","ResearchPublication"
"pub_paper_author_Zheyu_Fu_mobiquitous_2022","Publication of Research by Zheyu Fu at EAI Endorsed Trans. Ubiquitous Environ. 2022","ResearchPublication"
"pub_paper_author_Zheyu_Fu_mobiquitous_2016","Publication of Research by Zheyu Fu at EAI Endorsed Trans. Ubiquitous Environ. 2016","ResearchPublication"
"pub_paper_author_Zheyu_Fu_mobiquitous_2007","Publication of Research by Zheyu Fu at EAI Endorsed Trans. Ubiquitous Environ. 2007","ResearchPublication"
"pub_paper_author_Zheyu_Fu_mobiquitous_2024","Publication of Research by Zheyu Fu at EAI Endorsed Trans. Ubiquitous Environ. 2024","ResearchPublication"
"pub_paper_author_Danilo_Vasconcellos_Vargas_rlc_2021","Publication of Research by Danilo Vasconcellos Vargas at RLJ 2021","ResearchPublication"
"pub_paper_author_Danilo_Vasconcellos_Vargas_rlc_2011","Publication of Research by Danilo Vasconcellos Vargas at RLJ 2011","ResearchPublication"
"pub_paper_author_Danilo_Vasconcellos_Vargas_rlc_2024","Publication of Research by Danilo Vasconcellos Vargas at RLJ 2024","ResearchPublication"
"pub_paper_author_Danilo_Vasconcellos_Vargas_rlc_2008","Publication of Research by Danilo Vasconcellos Vargas at RLJ 2008","ResearchPublication"
"pub_paper_author_Kezhen_Xie_valuetools_2005","Publication of Research by Kezhen Xie at EAI Endorsed Trans. Ubiquitous Environ. 2005","ResearchPublication"
"pub_paper_author_Kezhen_Xie_valuetools_2014","Publication of Research by Kezhen Xie at EAI Endorsed Trans. Ubiquitous Environ. 2014","ResearchPublication"
"pub_paper_author_Kezhen_Xie_valuetools_2016","Publication of Research by Kezhen Xie at EAI Endorsed Trans. Ubiquitous Environ. 2016","ResearchPublication"
"pub_paper_author_Kezhen_Xie_valuetools_2015","Publication of Research by Kezhen Xie at EAI Endorsed Trans. Ubiquitous Environ. 2015","ResearchPublication"
"pub_paper_author_C._C._Li_rlc_2024","Publication of Research by C. C. Li at RLJ 2024","ResearchPublication"
"pub_paper_author_C._C._Li_rlc_2021","Publication of Research by C. C. Li at RLJ 2021","ResearchPublication"
"pub_paper_author_C._C._Li_rlc_2008","Publication of Research by C. C. Li at RLJ 2008","ResearchPublication"
"pub_paper_author_C._C._Li_rlc_2006","Publication of Research by C. C. Li at RLJ 2006","ResearchPublication"
"pub_paper_author_Nan_Jiang_0008_rlc_2024","Publication of Research by Nan Jiang 0008 at RLJ 2024","ResearchPublication"
