"id:ID","name",":LABEL"
"pub_journals/tcs/Kim94","Publication of Retreat Bounded Picture Languages.","ResearchPublication"
"pub_journals/cbsn/LiuK07","Publication of A Study of Internet Addiction through the Lens of the Interpersonal Theory.","ResearchPublication"
"pub_journals/cbsn/Lee-WonANW16","Publication of More Than Numbers: Effects of Social Media Virality Metrics on Intention to Help Unknown Others in the Context of Bone Marrow Donation.","ResearchPublication"
"pub_journals/jikm/Al-JanabiA16","Publication of A Study of Cyber Security Awareness in Educational Environment in the Middle East.","ResearchPublication"
"pub_journals/ipl/Group95","Publication of Fixed-Point Calculus.","ResearchPublication"
"pub_journals/jdi/BhanotS17","Publication of App Review Series: Epocrates.","ResearchPublication"
"pub_journals/smr/Hamouda13","Publication of The BSCBAS: a Balanced Scorecard-based appraisal system for improving the performance of software organizations.","ResearchPublication"
"pub_journals/smr/ZeroualiMGDCR19","Publication of A formal framework for measuring technical lag in component repositories - and its application to npm.","ResearchPublication"
"pub_journals/smr/PaasivaaraL14","Publication of Agile coaching for global software development.","ResearchPublication"
"pub_journals/cstat/SchellhaseK12","Publication of Density estimation and comparison with a penalized mixture approach.","ResearchPublication"
"pub_journals/iam/YinZWZWZ22","Publication of Motivating participation in crowdsourcing contests: The role of instruction-writing strategy.","ResearchPublication"
"pub_journals/spic/Bian20","Publication of An ensemble image quality assessment algorithm based on deep feature clustering.","ResearchPublication"
"pub_journals/vlsisp/ZhouPC20","Publication of Parallel Gibbs Sampler for Wavelet-Based Bayesian Compressive Sensing with High Reconstruction Accuracy.","ResearchPublication"
"pub_journals/ife/Hasselbring98","Publication of Erfahrungen mit dem Einsatz anwendungsspezifischer Piktogramme zur partizipativen Anforderungsanalyse.","ResearchPublication"
"pub_journals/jbcb/ChinnasamySM05","Publication of Protein Structure and Fold Prediction Using Tree-augmented Nave Bayesian Classifier.","ResearchPublication"
"pub_journals/jmrr/HamouMTAAM24","Publication of Comprehensive Review of Noninvasive Brain-Computer Interfaces for Controlling Robotic Arms.","ResearchPublication"
"pub_journals/jois/XieFHY15","Publication of Location Model and Algorithm of Construction Waste Recycling Centers for Service Reliability.","ResearchPublication"
"pub_journals/cg/StrackBDSGPMP94","Publication of Image communication open architecture.","ResearchPublication"
"pub_journals/icl/BocusDC13","Publication of An Approximation of the First Order Marcum Q-Function with Application to Network Connectivity Analysis.","ResearchPublication"
"pub_journals/jasis/SuLLL17","Publication of Boosting attribute recognition with latent topics by matrix factorization.","ResearchPublication"
"pub_journals/ijhci/WangDZYG24","Publication of Understanding the Continuance Intention of College Students toward New E-Learning Spaces Based on an Integrated Model of the TAM and TTF.","ResearchPublication"
"pub_journals/jct/GeelenHR18","Publication of Explicit bounds for graph minors.","ResearchPublication"
"pub_journals/jct/BruhnD09","Publication of MacLane's theorem for arbitrary surfaces.","ResearchPublication"
"pub_journals/nn/BrajovicMK98","Publication of Temporal photoreception for adaptive dynamic range image sensing and encoding.","ResearchPublication"
"pub_journals/nn/NaruseTOUS15","Publication of Phase shifts in alpha-frequency rhythm detected in electroencephalograms influence reaction time.","ResearchPublication"
"pub_journals/tasm/Tavoulareas24","Publication of The Gap Between Policy and Implementation Has Roots in Academia: How Policy Schools Can Narrow the Gap.","ResearchPublication"
"pub_journals/jcc/ZwierSK07","Publication of Hybrid molecular dynamics-quantum mechanics simulations of solute spectral properties in the condensed phase: Evaluation of simulation parameters.","ResearchPublication"
"pub_journals/rdlj/FilimonovVAM20","Publication of Application of Supercomputer Technologies for Long-Term Modeling of Permafrost Boundaries in the Oil and Gas Fields of the Arctic.","ResearchPublication"
"pub_journals/jr/JiC21","Publication of Disturbance Rejection Trajectory Tracking Control for an Unmanned Quadrotor Based on Hybrid Controllers.","ResearchPublication"
"pub_journals/ijmms/PengCWW18","Publication of Evaluating a 3-D virtual talking head on pronunciation learning.","ResearchPublication"
"pub_journals/ijmms/Lucas77","Publication of A Study of Patients' Attitudes to Computer Interrogation.","ResearchPublication"
"pub_journals/ijmms/HollnagelB00","Publication of Principles for modelling function allocation.","ResearchPublication"
"pub_journals/et/ElliotB23","Publication of An Investigation into the Failure Characteristics of External PCB Traces with Different Angle Bends.","ResearchPublication"
"pub_journals/quantum/GodleyG23","Publication of Adaptive measurement filter: efficient strategy for optimal estimation of quantum Markov chains.","ResearchPublication"
"pub_journals/wpc/TomovicYMR17","Publication of Software-Defined Fog Network Architecture for IoT.","ResearchPublication"
"pub_journals/cviu/LiuHHCC98","Publication of Accuracy vs Efficiency Trade-offs in Optical Flow Algorithms.","ResearchPublication"
"pub_journals/jscic/DingL19","Publication of A High-Order Algorithm for Time-Caputo-Tempered Partial Differential Equation with Riesz Derivatives in Two Spatial Dimensions.","ResearchPublication"
"pub_journals/robotica/ColbaughG95","Publication of Decentralized adaptive compliance control of robot manipulators.","ResearchPublication"
"pub_journals/twc/YuanLCHWZ23","Publication of JIRA: Joint Incentive Design and Resource Allocation for Edge-Based Real-Time Video Streaming Systems.","ResearchPublication"
"pub_journals/twc/KarasikSS13","Publication of Robust Uplink Communications over Fading Channels with Variable Backhaul Connectivity.","ResearchPublication"
"pub_journals/twc/KimLG11","Publication of Multi-Band Cognitive Radio Spectrum Sensing for Quality-of-Service Traffic.","ResearchPublication"
"pub_journals/pvldb/TangMYC19","Publication of Creating Top Ranking Options in the Continuous Option and Preference Space.","ResearchPublication"
"pub_journals/mr/HaniniA18","Publication of Electro thermal modeling of the power diode using Pspice.","ResearchPublication"
"pub_journals/cacm/Littman12","Publication of A new way to search game trees: technical perspective.","ResearchPublication"
"pub_journals/cj/AhmadD95","Publication of On the m-Way Graph Partitioning Problem.","ResearchPublication"
"pub_journals/cj/FlynnL85","Publication of Mapping from a Conceptual Schema to a Target Internal Schema.","ResearchPublication"
"pub_journals/frai/ZamprognoDHR23","Publication of A hybrid computational approach to anticipate individuals in sequential problem solving.","ResearchPublication"
"pub_journals/ijdet/TejedorMV08","Publication of An Online Virtual Laboratory of Electricity.","ResearchPublication"
"pub_journals/jfr/SakagamiKYMMSK23","Publication of Sediment penetration performance of a portable underwater robot for core sampling.","ResearchPublication"
"pub_journals/mis/Wang21j","Publication of Digital Design of Smart Museum Based on Artificial Intelligence.","ResearchPublication"
"pub_journals/vc/ShiYSPG10","Publication of Filling ","ResearchPublication"
"pub_journals/ijcse/YuWS19","Publication of Decomposition-based multi-objective comprehensive learning particle swarm optimisation.","ResearchPublication"
"pub_journals/crl/MongeonSASL21","Publication of Collection Development in the Era of Big Deals.","ResearchPublication"
"pub_journals/amai/KowalskiS11","Publication of Abductive logic programming agents with destructive databases.","ResearchPublication"
"pub_journals/chk/Bunnell17","Publication of An Invitation to Creative Reflection.","ResearchPublication"
"pub_journals/jds/TaylorBD20","Publication of Mandated assimilation of supply chain management systems and the role of channel governance mechanisms.","ResearchPublication"
"pub_journals/entropy/CremaschiniT23","Publication of Unconstrained Lagrangian Variational Principles for the Einstein Field Equations.","ResearchPublication"
"pub_journals/entropy/TuZJP18","Publication of Multiscale Distribution Entropy and t-Distributed Stochastic Neighbor Embedding-Based Fault Diagnosis of Rolling Bearings.","ResearchPublication"
"pub_journals/entropy/DobreGCC20","Publication of Beta Type Stirling Engine. Schmidt and Finite Physical Dimensions Thermodynamics Methods Faced to Experiments.","ResearchPublication"
"pub_journals/symmetry/OzisikSB23","Publication of Soliton Waves with the (3+1)-Dimensional Kadomtsev-Petviashvili-Boussinesq Equation in Water Wave Dynamics.","ResearchPublication"
"pub_journals/symmetry/CelantTM21","Publication of Total Effective Vascular Compliance of a Global Mathematical Model for the Cardiovascular System.","ResearchPublication"
"pub_journals/symmetry/HuZY19","Publication of A Unified Proximity Algorithm with Adaptive Penalty for Nuclear Norm Minimization.","ResearchPublication"
"pub_journals/jvcir/JiaSZW16","Publication of An image restoration model combining mixed L","ResearchPublication"
"pub_journals/jvcir/YuanLWZ14","Publication of Multiple kernel learning with NOn-conVex group spArsity.","ResearchPublication"
"pub_journals/nca/XieWHQZ21","Publication of Graph convolutional networks with attention for multi-label weather recognition.","ResearchPublication"
"pub_journals/orl/Xing02","Publication of A bin packing problem with over-sized items.","ResearchPublication"
"pub_journals/orl/LinYH98","Publication of Parallel machine scheduling to maximize the minimum load with nonsimultaneous machine available times.","ResearchPublication"
"pub_journals/scl/BaldeaT13","Publication of Nonlinear model predictive control of energy-integrated process systems.","ResearchPublication"
"pub_journals/sensors/UsamaE19","Publication of A Survey on Recent Trends and Open Issues in Energy Efficiency of 5G.","ResearchPublication"
"pub_journals/sensors/ZhangJLMH21","Publication of Design of a New Seismoelectric Logging Instrument.","ResearchPublication"
"pub_journals/patterns/ReeseUCCRCSGBFB21","Publication of KG-COVID-19: A Framework to Produce Customized Knowledge Graphs for COVID-19 Response.","ResearchPublication"
"pub_journals/kybernetika/LiuJL10","Publication of Rejection of nonharmonic disturbances in nonlinear systems.","ResearchPublication"
"pub_journals/kybernetika/Kucera91","Publication of Special issue: System Structure and Control. I.","ResearchPublication"
"pub_journals/jossw/Peeters18","Publication of Cadabra2: computer algebra for field theory revisited.","ResearchPublication"
"pub_journals/intpolrev/DencikRHW19","Publication of The 'golden view': data-driven governance in the scoring society.","ResearchPublication"
"pub_journals/chinaf/WuWBSYYZBWRWCH24","Publication of Investigation and mitigation of Mott neuronal oscillation fluctuation in spiking neural network.","ResearchPublication"
"pub_journals/peerj-cs/LuG24","Publication of Multi-grained alignment method based on stable topics in cross-social networks.","ResearchPublication"
"pub_journals/tcom/RossT91","Publication of An enhancement to blind equalization algorithms.","ResearchPublication"
"pub_journals/tgrs/SuZDD19","Publication of Kernel Collaborative Representation With Local Correlation Features for Hyperspectral Image Classification.","ResearchPublication"
"pub_journals/tgrs/ZhiWZYPSLZ19","Publication of FengYun-3 B Satellite Medium Resolution Spectral Imager Visible On-Board Calibrator Radiometric Output Degradation Analysis.","ResearchPublication"
"pub_journals/tgrs/MartinisTV11","Publication of Unsupervised Extraction of Flood-Induced Backscatter Changes in SAR Data Using Markov Image Modeling on Irregular Graphs.","ResearchPublication"
"pub_journals/tgrs/YanHDYWC23","Publication of STDMANet: Spatio-Temporal Differential Multiscale Attention Network for Small Moving Infrared Target Detection.","ResearchPublication"
"pub_journals/ijac/BrusamarelloFJ14","Publication of Classification of involutions on finitary incidence algebras.","ResearchPublication"
"pub_journals/jco/Cai99","Publication of Inverse Problems of Matroid Intersection.","ResearchPublication"
"pub_journals/cbm/dinDRA22","Publication of Breast cancer detection using deep learning: Datasets, methods, and challenges ahead.","ResearchPublication"
"pub_journals/cbm/XuYKWL19","Publication of Document-level attention-based BiLSTM-CRF incorporating disease dictionary for disease named entity recognition.","ResearchPublication"
"pub_journals/jcit/KarmakarB09","Publication of Privacy Preserving Data Mining Using Matrix Algebraic Approach.","ResearchPublication"
"pub_journals/tase/MengCMWM24a","Publication of Learning-Based Risk-Bounded Path Planning Under Environmental Uncertainty.","ResearchPublication"
"pub_journals/ajc/BachratyJ17","Publication of Classification of coset-preserving skew-morphisms of finite cyclic groups.","ResearchPublication"
"pub_journals/imt/PurwariantiTN07","Publication of Indonesian-Japanese Transitive Translation using English for CLIR.","ResearchPublication"
"pub_journals/csda/WieringaDGP09","Publication of Generalised Procrustes Analysis with optimal scaling: Exploring data from a power supplier.","ResearchPublication"
"pub_journals/tac/FangC00","Publication of Stability and instability of limit points for stochastic approximation algorithms.","ResearchPublication"
"pub_journals/tac/WuS13","Publication of On Easily Verifiable Conditions for the Existence of Common Linear Copositive Lyapunov Functions.","ResearchPublication"
"pub_journals/tac/LiangXWZ23","Publication of Decentralized Output-Feedback Control With Asymmetric One-Step Delayed Information.","ResearchPublication"
"pub_journals/tim/XueLCFS25","Publication of A Hybrid Data-Driven Model for Predicting NOx Concentration in a Cement Clinker Calcination System.","ResearchPublication"
"pub_journals/tim/GuptaMD05","Publication of Real-time identification and predictive control of fast mobile robots using global vision sensing.","ResearchPublication"
"pub_journals/cce/Sahinidis04","Publication of Optimization under uncertainty: state-of-the-art and opportunities.","ResearchPublication"
"pub_journals/ijim/ChechinaCT20","Publication of Modelling Traffic on Road Junctions on Parallel Computing Systems Using Cellular Automata Approach.","ResearchPublication"
"pub_journals/ijim/MentzelopoulosF16","Publication of Perceptual User Interface Framework for Immersive Information Retrieval Environments (An Experimental Framework for Testing and Rapid Iteration).","ResearchPublication"
"pub_journals/tele/DodooY21","Publication of Snapping and chatting away: Consumer motivations for and outcomes of interacting with Snapchat AR ad lens.","ResearchPublication"
"pub_journals/jips/FanG23","Publication of Personalized Recommendation Algorithm of Interior Design Style Based on Local Social Network.","ResearchPublication"
"pub_journals/imds/CaputoPS17","Publication of Modeling errors in parts supply processes for assembly lines feeding.","ResearchPublication"
"pub_journals/fuin/PaganiR10","Publication of Linearity, Non-determinism and Solvability.","ResearchPublication"
"pub_journals/cais/CarmelE06","Publication of Narratives that Software Nations Tell Themselves: An Exploration and Taxonomy.","ResearchPublication"
"pub_journals/imwut/XieLZXZLYRG22","Publication of TransFloor: Transparent Floor Localization for Crowdsourcing Instant Delivery.","ResearchPublication"
"pub_journals/todaes/HongHXLSZ23","Publication of Programmable In-memory Computing Circuit of Fast Hartley Transform.","ResearchPublication"
"pub_journals/spl/ReddyC25","Publication of Recovery of Signals on a Simplicial Complex From Subsampled Neighborhood Aggregations.","ResearchPublication"
"pub_journals/eor/JonesO08","Publication of Long-range timber supply planning for a vertically integrated paper mill.","ResearchPublication"
"pub_journals/eor/JohnsonM08","Publication of Outlier detection in two-stage semiparametric DEA models.","ResearchPublication"
"pub_journals/cas/NguyenT24","Publication of Intelligent Collectives: Impact of Independence on Collective Performance.","ResearchPublication"
"pub_journals/ijfcs/ChangLT09","Publication of Testing Embeddability between Metric Spaces.","ResearchPublication"
"pub_journals/pr/YanKS14","Publication of Modeling local behavior for predicting social interactions towards human tracking.","ResearchPublication"
"pub_journals/cys/Arechavaleta11","Publication of Optimizacin de Trayectorias para Sistemas Sujetos a Restricciones No Holnomas.","ResearchPublication"
"pub_journals/jkm/Lardon-LopezMG22","Publication of ""Social media technologies: a waste of time or a good way to learn and improve technological competences?"".","ResearchPublication"
"pub_journals/lmcs/Hardin05","Publication of Modularizing the Elimination of r=0 in Kleene Algebra.","ResearchPublication"
"pub_journals/jifs/LiZ15","Publication of A new dissimilarity measure between intuitionistic fuzzy sets and its application in multiple attribute decision making.","ResearchPublication"
"pub_journals/jcphy/SpietzHW18","Publication of A regularization method for solving the Poisson equation for mixed unbounded-periodic domains.","ResearchPublication"
"pub_journals/eInformatica/IqbalAAK20","Publication of Extending UML Use Case Diagrams to Represent Non-Interactive Functional Requirements.","ResearchPublication"
"pub_journals/iajit/HaratyG04","Publication of Arabic Text Recognition.","ResearchPublication"
"pub_journals/bmcbi/ZhangWCHLSZ19","Publication of PIXER: an automated particle-selection method based on segmentation using a deep neural network.","ResearchPublication"
"pub_journals/access/CastellanosCDTV22","Publication of Evaluation of Beamsteering Performance in MultiuserMIMO Unmanned Aerial Base Stations Networks.","ResearchPublication"
"pub_journals/access/garciaChavezSGMOST23","Publication of A Robust Sliding Mode and PI-Based Tracking Control for the MIMO DC/DC Buck Converter-Inverter-DC Motor System.","ResearchPublication"
"pub_journals/access/XiaoJ019","Publication of High-Level Video Event Modeling, Recognition, and Reasoning via Petri Net.","ResearchPublication"
"pub_journals/access/ZhouLWLZZ20","Publication of Capacity and Security Analysis of Multi-Mode Orbital Angular Momentum Communications.","ResearchPublication"
"pub_journals/access/LiZLZLWDW23","Publication of A Novel 32-Point Modulation Scheme of 6PolSK-QPSK Signal.","ResearchPublication"
"pub_journals/access/ZengMZDLZ21","Publication of Construction of a 3D Stratum Model Based on a Solid Model.","ResearchPublication"
"pub_journals/access/LiL22b","Publication of Design and Comparative Analysis on Real-Time Trade of Road Priority in Connected Traffic.","ResearchPublication"
"pub_journals/access/WangCDW24","Publication of Airport Visibility Classification Based on Multimodal Fusion of Image-Tabular Data.","ResearchPublication"
"pub_journals/access/HazanS19","Publication of Improving Grid-Based Location Prediction Algorithms by Speed and Direction Based Boosting.","ResearchPublication"
"pub_journals/ijon/ZhengLW09","Publication of New LMT-based delay-dependent criterion for global asymptotic stability of cellular neural networks.","ResearchPublication"
"pub_journals/ijon/ChamlalBO24","Publication of Maximal cliques-based hybrid high-dimensional feature selection with interaction screening for regression.","ResearchPublication"
"pub_journals/itp/NosekM97","Publication of Augmenting group sense making in ill-defined, emerging situations: Experiences, lessons learned and issues for future development.","ResearchPublication"
"pub_journals/itp/DestounisGMRST04","Publication of Designing for ease is designing for all: Experiences from a simplified office suite.","ResearchPublication"
"pub_journals/tog/FleishmanDC03","Publication of Bilateral mesh denoising.","ResearchPublication"
"pub_journals/tetc/WeiLLGY21","Publication of SDLSC-TA: Subarea Division Learning Based Task Allocation in Sparse Mobile Crowdsensing.","ResearchPublication"
"pub_journals/scn/ZhouNW21","Publication of Fine-Grained Attribute-Based Multikeyword Search for Shared Multiowner in Internet of Things.","ResearchPublication"
"pub_journals/siamma/CraigGLS18","Publication of Bloch Theory and Spectral Gaps for Linearized Water Waves.","ResearchPublication"
"pub_journals/jcam/KrukierMB09","Publication of Product-type skew-Hermitian triangular splitting iteration methods for strongly non-Hermitian positive definite linear systems.","ResearchPublication"
"pub_journals/ieicet/TakahashiIF19","Publication of Frequency-Domain EMI Simulation of Power Electronic Converter with Voltage-Source and Current-Source Noise Models.","ResearchPublication"
"pub_journals/ieicet/MatsumotoNS12","Publication of Blocked United Algorithm for the All-Pairs Shortest Paths Problem on Hybrid CPU-GPU Systems.","ResearchPublication"
"pub_journals/ieicet/TsujiUKS10","Publication of Accurate Estimation of the Number of Weak Coherent Signals.","ResearchPublication"
"pub_journals/ieicet/TanakaKT06","Publication of PMPATH: A Policy Routing System for Multihomed End-Hosts.","ResearchPublication"
"pub_journals/adcm/PangWL20","Publication of A cubic spline penalty for sparse approximation under tight frame balanced model.","ResearchPublication"
"pub_journals/ai/Lin01","Publication of On strongest necessary and weakest sufficient conditions.","ResearchPublication"
"pub_journals/amc/HanMD19","Publication of High-order stochastic symplectic partitioned Runge-Kutta methods for stochastic Hamiltonian systems with additive noise.","ResearchPublication"
"pub_journals/amc/LiuZW13","Publication of A collocation scheme for a certain Cauchy singular integral equation based on the superconvergence analysis.","ResearchPublication"
"pub_journals/amc/TanYCK23","Publication of An efficient time-dependent auxiliary variable approach for the three-phase conservative Allen-Cahn fluids.","ResearchPublication"
"pub_journals/jsac/ZhuHK22","Publication of Distributed Resource Optimization for NOMA Transmission in Beamforming SATCOM.","ResearchPublication"
"pub_journals/aei/ZhouDZL18","Publication of Topological mapping and assessment of multiple settlement time series in deep excavation: A complex network perspective.","ResearchPublication"
"pub_journals/aei/MaCHLZG24","Publication of Research on the low-dimensional visualization and identification method of the equipments conditions by cloud-based screening and hypergraph embedding.","ResearchPublication"
"pub_journals/tjs/LiuLHCZ25","Publication of Traffic target detection based on context enhancement and feature purification.","ResearchPublication"
"pub_journals/ijat/Furutani10","Publication of Proposal for Abrasive Layer Fabrication on Thin Wire by Electrical Discharge Machining.","ResearchPublication"
"pub_journals/tomacs/KawaiKTM17","Publication of A Virtual WLAN Device Model for High-Fidelity Wireless Network Emulation.","ResearchPublication"
"pub_journals/jrm/TakashimaONCNM24","Publication of Development and Application of Shape-Memory Polymer and Alloy Composite Sheets.","ResearchPublication"
"pub_journals/ieeesp/BishopF06","Publication of Who Owns Your Computer?","ResearchPublication"
"pub_journals/tie/MaTHPT24","Publication of Complex PQD Classification Using Time- Frequency Analysis and Multiscale Parallel Attention Residual Network.","ResearchPublication"
"pub_journals/oclc/Fox11","Publication of The golden mean.","ResearchPublication"
"pub_journals/fss/FungCT06","Publication of Estimating the functional relationships for quality function deployment under uncertainties.","ResearchPublication"
"pub_journals/jcde/ZhangYV21","Publication of Transient performance of a solar humidification-dehumidification desalination system based on hollow fiber membrane.","ResearchPublication"
"pub_journals/iacr/ChalkiasBHLNS18","Publication of Blockchained Post-Quantum Signatures.","ResearchPublication"
"pub_journals/pieee/HartungK99","Publication of Multimedia watermarking techniques.","ResearchPublication"
"pub_journals/iotj/AsieduMSKL20","Publication of Beamforming and Resource Allocation for Multiuser Full-Duplex Wireless-Powered Communications in IoT Networks.","ResearchPublication"
"pub_journals/iotj/NiuLCZXNLA23","Publication of Joint Beamforming Design for Secure RIS-Assisted IoT Networks.","ResearchPublication"
"pub_journals/iotj/LiSCL17","Publication of Building/Environment Data/Information Enabled Location Specificity and Indoor Positioning.","ResearchPublication"
"pub_journals/ploscb/YpmaB16","Publication of Statistical Analysis of Tract-Tracing Experiments Demonstrates a Dense, Complex Cortical Network in the Mouse.","ResearchPublication"
"pub_journals/ploscb/RaketGSIM16","Publication of Separating Timing, Movement Conditions and Individual Differences in the Analysis of Human Movement.","ResearchPublication"
"pub_journals/scjapan/KuroyanagiI05","Publication of A competitive learning neural network for auditory information processing using the pulsed neuron model.","ResearchPublication"
"pub_journals/micro/X01i","Publication of Product Summary.","ResearchPublication"
"pub_journals/tii/MarauLVMAPF08","Publication of Performing Flexible Control on Low-Cost Microcontrollers Using a Minimal Real-Time Kernel.","ResearchPublication"
"pub_journals/fs/Schachermayer03","Publication of A super-martingale property of the optimal portfolio process.","ResearchPublication"
"pub_journals/ijcim/ChenSC15","Publication of Capacity planning for integrated circuit final test plants.","ResearchPublication"
"pub_journals/topnoc/AndreKLPP19","Publication of Parametric Verification: An Introduction.","ResearchPublication"
